Date,Supporter,Message,Amount,Post URL,Title
2026-05-28,Example Supporter,For the Vallen notes,7,https://ko-fi.com/parallaxhearts/post/1,Field note from Vallen
2026-05-29,Archive Friend,Keep the town archive open,12,https://ko-fi.com/parallaxhearts/post/2,What the Town Keeps fragment
2026-05-30,Listener A,Song notes,5,https://ko-fi.com/parallaxhearts/post/3,Song note
2026-05-31,Reader B,More visual novel work,10,https://ko-fi.com/parallaxhearts/post/4,Visual novel archive
2026-06-01,Quiet Signal,For the rainy dispatch,8,https://ko-fi.com/parallaxhearts/post/5,Rainy town atmosphere
